{
  "schema": "gooo/profile-response-input/v1",
  "packet": {
    "schema": "gooo/contribution-response-input/v1",
    "id": "koanf-07",
    "origin": "synthetic",
    "repository": "knadh/koanf",
    "actor": {
      "id": "kimjooyoon",
      "observed_role": "author"
    },
    "phase": "internal_draft",
    "policy": {
      "id": "synthetic/koanf/planning",
      "source_url": "https://github.com/hashicorp/hcl/pull/815#issuecomment-6346695196",
      "source_identity": "synthetic-policy",
      "basis": "synthetic",
      "external_requirement": "satisfied"
    },
    "conversation": {
      "observed_at": "2026-10-22T20:00:00Z",
      "as_of": "2026-10-22T20:00:00Z",
      "max_age_seconds": 3600,
      "snapshot_id": "fixture/hcl/one",
      "current_snapshot_id": "fixture/hcl/one",
      "tested_head": null,
      "current_head": null,
      "interaction": {
        "review_state": "unknown",
        "minimization": "not_observed",
        "lock": "unknown",
        "composer": "unknown",
        "submission": "not_attempted",
        "permission": "unknown"
      }
    },
    "requested": true,
    "adds_information": false,
    "claims": [
      {
        "id": "review-state",
        "actor_id": "kimjooyoon",
        "asserted_role": "author",
        "kind": "bounded_confirmation",
        "status": "observed",
        "tested_revision": null,
        "evidence_ids": [
          "process"
        ],
        "uncertainty": [
          "Minimization does not establish dismissal, AI detection or a correctness verdict."
        ],
        "failures": [],
        "exclusions": []
      }
    ],
    "evidence": [
      {
        "schema": "gooo/contribution-evidence/v1",
        "id": "process",
        "origin": "synthetic",
        "identities": {
          "source_commit": null,
          "source_blob": null,
          "base_commit": null,
          "candidate_commit": null,
          "reference_name": null,
          "reference_version": null,
          "reference_commit": null
        },
        "execution": {
          "phase": "source_review",
          "outcome": "not_compared",
          "tested_scope": [
            "Public process and interaction observations; not new execution"
          ],
          "comparison": "not_compared",
          "base_outcome": "not_compared",
          "candidate_outcome": "not_compared"
        },
        "references": [
          {
            "id": "default-hook-suggestion",
            "url": "https://github.com/knadh/koanf/pull/464#issuecomment-6337805846",
            "sha256": null
          }
        ],
        "uncertainty": [
          "Synthetic offline planning packet; not new acquisition, execution or current recipient acceptance."
        ],
        "failures": [],
        "exclusions": [
          "No new live collection or external submission."
        ]
      }
    ],
    "uncertainty": [
      "These are explicitly synthetic planning packets based on linked historical observations."
    ],
    "failures": [],
    "exclusions": [
      "No maintainer acceptance, current posting permission or production impact is established.",
      "Unrequested duplicate confirmation adds no new defect, decision or reusable test."
    ]
  },
  "profile_ref": {
    "id": "koanf",
    "sha256": "d52300e8b7cf9749aadee1488ae13b7a73ecff355138987f321ddef6674d7b45"
  },
  "provisional_category": null,
  "context": {
    "responsible_understanding": "unknown",
    "discovery_origin": "unknown",
    "production_incident": "unknown",
    "prevalence": "unknown",
    "suggestion_authority": "collaborator",
    "api_approval": "unknown",
    "recipient_acceptance": "unknown",
    "interaction_restriction": "unknown",
    "docs_tests_relation": "unknown",
    "guide_status": "unknown",
    "implementation_state": "submitted",
    "ci_status": "unknown",
    "agreement": "unknown",
    "pr_invitation": "unknown",
    "profile_as_of": "2026-10-24T23:25:40Z",
    "max_profile_age_seconds": 86400,
    "schema": "gooo/contribution-context/v1",
    "policy_discovery": "bounded",
    "intent": "internal_notes",
    "ai_disclosure": "observed",
    "publication": "not_posted",
    "runtime_tested": "not_observed",
    "fixture_source_pinned": false,
    "alternate_channel_available": false,
    "requirements_evidence_ids": []
  },
  "assertions": [
    {
      "claim_id": "review-state",
      "field": "classification",
      "value": "implemented_suggestion"
    },
    {
      "claim_id": "review-state",
      "field": "suggestion_authority",
      "value": "collaborator"
    },
    {
      "claim_id": "review-state",
      "field": "api_approval",
      "value": "unknown"
    }
  ],
  "example": {
    "input": "custom decoder with ErrorUnused and explicit DefaultDecodeHook opt-in",
    "observed": "supplied implementation retains the default hook chain and credits rhnvrm",
    "expected": "custom configs replace defaults; hooks and weak typing are explicit opt-ins"
  }
}
