{
  "schema": "gooo/profile-response-input/v1",
  "packet": {
    "schema": "gooo/contribution-response-input/v1",
    "id": "vendor-supplement",
    "origin": "synthetic",
    "repository": "kimjooyoon/gooo-go-ports",
    "actor": {
      "id": "kimjooyoon",
      "observed_role": "reviewer"
    },
    "phase": "internal_draft",
    "policy": {
      "id": "fixture/hcl/process-v1",
      "source_url": "https://github.com/hashicorp/hcl/pull/815#issuecomment-6346695196",
      "source_identity": "issuecomment-6346695196",
      "basis": "direct_feedback",
      "external_requirement": "unknown"
    },
    "conversation": {
      "observed_at": "2026-10-22T20:00:00Z",
      "as_of": "2026-10-22T20:00:00Z",
      "max_age_seconds": 3600,
      "snapshot_id": "fixture/hcl/one",
      "current_snapshot_id": "fixture/hcl/one",
      "tested_head": null,
      "current_head": null,
      "interaction": {
        "review_state": "unknown",
        "minimization": "not_observed",
        "lock": "unknown",
        "composer": "unknown",
        "submission": "not_attempted",
        "permission": "unknown"
      }
    },
    "requested": true,
    "adds_information": false,
    "claims": [
      {
        "id": "review-state",
        "actor_id": "kimjooyoon",
        "asserted_role": "reviewer",
        "kind": "bounded_confirmation",
        "status": "observed",
        "tested_revision": null,
        "evidence_ids": [
          "process"
        ],
        "uncertainty": [
          "Minimization does not establish dismissal, AI detection or a correctness verdict."
        ],
        "failures": [],
        "exclusions": []
      }
    ],
    "evidence": [
      {
        "schema": "gooo/contribution-evidence/v1",
        "id": "process",
        "origin": "synthetic",
        "identities": {
          "source_commit": null,
          "source_blob": null,
          "base_commit": null,
          "candidate_commit": null,
          "reference_name": null,
          "reference_version": null,
          "reference_commit": null
        },
        "execution": {
          "phase": "source_review",
          "outcome": "not_compared",
          "tested_scope": [
            "Vendor-reported source/package assessment of preview.13 dated 20 October; no server launch or tool enumeration"
          ],
          "comparison": "not_compared",
          "base_outcome": "not_compared",
          "candidate_outcome": "not_compared"
        },
        "references": [
          {
            "id": "public-vendor-report-summary",
            "url": "https://github.com/kimjooyoon/gooo-language-bridge/issues/33",
            "sha256": null
          }
        ],
        "uncertainty": [
          "Synthetic offline planning packet; not new acquisition, execution or current recipient acceptance.",
          "Exact assessed commit unavailable; this fixture is not an independently replayed run. Private support email is not republished."
        ],
        "failures": [],
        "exclusions": [
          "No new live collection or external submission."
        ]
      }
    ],
    "uncertainty": [
      "These are explicitly synthetic planning packets based on linked historical observations."
    ],
    "failures": [],
    "exclusions": [
      "No maintainer acceptance, current posting permission or production impact is established.",
      "Unrequested duplicate confirmation adds no new defect, decision or reusable test."
    ]
  },
  "profile_ref": null,
  "provisional_category": "language_runtime",
  "context": {
    "responsible_understanding": "unknown",
    "discovery_origin": "external_report",
    "production_incident": "unknown",
    "prevalence": "unknown",
    "suggestion_authority": "unknown",
    "api_approval": "unknown",
    "recipient_acceptance": "unknown",
    "interaction_restriction": "unknown",
    "docs_tests_relation": "unknown",
    "guide_status": "unknown",
    "implementation_state": "unknown",
    "ci_status": "unknown",
    "agreement": "unknown",
    "pr_invitation": "unknown",
    "profile_as_of": "2026-10-24T23:25:40Z",
    "max_profile_age_seconds": 86400,
    "schema": "gooo/contribution-context/v1",
    "policy_discovery": "provisional",
    "intent": "internal_notes",
    "ai_disclosure": "observed",
    "publication": "not_posted",
    "runtime_tested": "not_observed",
    "fixture_source_pinned": false,
    "alternate_channel_available": false,
    "requirements_evidence_ids": []
  },
  "assertions": [
    {
      "claim_id": "review-state",
      "field": "classification",
      "value": "assessment_observation"
    },
    {
      "claim_id": "review-state",
      "field": "runtime_tested",
      "value": "not_observed"
    },
    {
      "claim_id": "review-state",
      "field": "execution_phase",
      "value": "source_review"
    }
  ],
  "example": null
}
