{
  "schema": "gooo/profile-response-input/v1",
  "packet": {
    "schema": "gooo/contribution-response-input/v1",
    "id": "koanf-16",
    "origin": "synthetic",
    "repository": "knadh/koanf",
    "actor": {
      "id": "kimjooyoon",
      "observed_role": "author"
    },
    "phase": "internal_draft",
    "policy": {
      "id": "synthetic/koanf/planning",
      "source_url": "https://github.com/go-git/go-git/pull/2530#issuecomment-6339776245",
      "source_identity": "synthetic-policy",
      "basis": "synthetic",
      "external_requirement": "satisfied"
    },
    "conversation": {
      "observed_at": "2026-10-22T20:00:00Z",
      "as_of": "2026-10-22T20:00:00Z",
      "max_age_seconds": 3600,
      "snapshot_id": "fixture/go-git/one",
      "current_snapshot_id": "fixture/go-git/one",
      "tested_head": "2222222222222222222222222222222222222222",
      "current_head": "2222222222222222222222222222222222222222",
      "interaction": {
        "review_state": "unknown",
        "minimization": "not_observed",
        "lock": "unknown",
        "composer": "unknown",
        "submission": "not_attempted",
        "permission": "unknown"
      }
    },
    "requested": false,
    "adds_information": true,
    "claims": [
      {
        "id": "original-fixed",
        "actor_id": "kimjooyoon",
        "asserted_role": "author",
        "kind": "original_finding_fixed",
        "status": "resolved",
        "tested_revision": "2222222222222222222222222222222222222222",
        "evidence_ids": [
          "original"
        ],
        "uncertainty": [],
        "failures": [],
        "exclusions": [
          "No full gitignore conformance claim."
        ]
      },
      {
        "id": "base-limitation",
        "actor_id": "kimjooyoon",
        "asserted_role": "author",
        "kind": "pre_existing_limitation",
        "status": "observed",
        "tested_revision": "2222222222222222222222222222222222222222",
        "evidence_ids": [
          "existing"
        ],
        "uncertainty": [],
        "failures": [],
        "exclusions": [
          "No full gitignore conformance claim."
        ]
      }
    ],
    "evidence": [
      {
        "schema": "gooo/contribution-evidence/v1",
        "id": "original",
        "origin": "synthetic",
        "identities": {
          "source_commit": "2222222222222222222222222222222222222222",
          "source_blob": null,
          "base_commit": "1111111111111111111111111111111111111111",
          "candidate_commit": "2222222222222222222222222222222222222222",
          "reference_name": "Git",
          "reference_version": "fixture-version",
          "reference_commit": null
        },
        "execution": {
          "phase": "targeted_tests",
          "outcome": "pass",
          "tested_scope": [
            "Focused DefaultDecodeHook tests (synthetic fixture)"
          ],
          "comparison": "base_and_candidate",
          "base_outcome": "fail",
          "candidate_outcome": "pass"
        },
        "references": [
          {
            "id": "focused-hook-and-baseline-scope",
            "url": "https://github.com/knadh/koanf/pull/464",
            "sha256": null
          }
        ],
        "uncertainty": [
          "Synthetic offline planning packet; not new acquisition, execution or current recipient acceptance."
        ],
        "failures": [],
        "exclusions": [
          "No new live collection or external submission."
        ]
      },
      {
        "schema": "gooo/contribution-evidence/v1",
        "id": "existing",
        "origin": "synthetic",
        "identities": {
          "source_commit": "2222222222222222222222222222222222222222",
          "source_blob": null,
          "base_commit": "1111111111111111111111111111111111111111",
          "candidate_commit": "2222222222222222222222222222222222222222",
          "reference_name": "Git",
          "reference_version": "fixture-version",
          "reference_commit": null
        },
        "execution": {
          "phase": "targeted_tests",
          "outcome": "fail",
          "tested_scope": [
            "Baseline watch failures remain on both sources (synthetic fixture)"
          ],
          "comparison": "base_and_candidate",
          "base_outcome": "fail",
          "candidate_outcome": "fail"
        },
        "references": [
          {
            "id": "focused-hook-and-baseline-scope",
            "url": "https://github.com/knadh/koanf/pull/464",
            "sha256": null
          }
        ],
        "uncertainty": [
          "Synthetic offline planning packet; not new acquisition, execution or current recipient acceptance."
        ],
        "failures": [
          "Baseline watch test failures persist; focused success is not a full-suite pass."
        ],
        "exclusions": [
          "No new live collection or external submission."
        ]
      }
    ],
    "uncertainty": [
      "These are explicitly synthetic planning packets based on linked historical observations."
    ],
    "failures": [],
    "exclusions": [
      "No maintainer acceptance, current posting permission or production impact is established."
    ]
  },
  "profile_ref": {
    "id": "koanf",
    "sha256": "d52300e8b7cf9749aadee1488ae13b7a73ecff355138987f321ddef6674d7b45"
  },
  "provisional_category": null,
  "context": {
    "responsible_understanding": "unknown",
    "discovery_origin": "unknown",
    "production_incident": "unknown",
    "prevalence": "unknown",
    "suggestion_authority": "collaborator",
    "api_approval": "unknown",
    "recipient_acceptance": "unknown",
    "interaction_restriction": "unknown",
    "docs_tests_relation": "unknown",
    "guide_status": "unknown",
    "implementation_state": "submitted",
    "ci_status": "action_required",
    "agreement": "unknown",
    "pr_invitation": "unknown",
    "profile_as_of": "2026-10-24T23:25:40Z",
    "max_profile_age_seconds": 86400,
    "schema": "gooo/contribution-context/v1",
    "policy_discovery": "bounded",
    "intent": "internal_notes",
    "ai_disclosure": "observed",
    "publication": "not_posted",
    "runtime_tested": "observed",
    "fixture_source_pinned": false,
    "alternate_channel_available": false,
    "requirements_evidence_ids": []
  },
  "assertions": [
    {
      "claim_id": "original-fixed",
      "field": "overall_test_status",
      "value": "scope_only"
    },
    {
      "claim_id": "original-fixed",
      "field": "ci_status",
      "value": "action_required"
    },
    {
      "claim_id": "original-fixed",
      "field": "execution_phase",
      "value": "targeted_tests"
    }
  ],
  "example": null
}
